location,company,relevance
St. Paul (STP),regeneron,"St. Paul hosts key partners, biotech collaboration."
Orlando (SFB),regeneron,Regeneron's partnerships enhance Orlando's biomedical innovation landscape.
El Paso (ELP),regeneron,El Paso hosts clinical trials and collaborations.
San Jose del Cabo (SJD),regeneron,San Jose del Cabo: Strategic retreat for executives.
Van Nuys (VNY),regeneron,Van Nuys serves as strategic corporate travel hub.
Scottsdale (SCF),regeneron,Scottsdale hosts biotech conferences and networking opportunities.
Honolulu (HNL),regeneron,Possible vacation spot; potential business meetings.
Kahului (OGG),regeneron,Kahului: Potential vacation spot for executives.
Seattle (BFI),regeneron,Seattle hosts biotech innovation; key partners meet.
Vancouver (YVR),regeneron,Regeneron's partnerships; Vancouver's biotech innovation hub thriving.
San Jose (SJC),regeneron,"San Jose hosts biotech innovation, potential partnerships."
San Diego (SAN),regeneron,"San Diego hosts partnerships, research opportunities, connections."
Pendleton (PDT),regeneron,Pendleton may host Regeneron stakeholder meetings.
San Francisco (SFO),regeneron,San Francisco hosts biotech collaborations and innovation.
Miami (OPF),regeneron,"Miami (OPF) connects to biotech collaborations, networking."
Jacksonville (JAX),regeneron,Jacksonville has strategic partnerships and biotech potential.
Liberia (LIR),regeneron,"Private investment, partnerships, and emerging market opportunities."
Naples (APF),regeneron,"Regeneron's Naples visit: strategic partnerships, networking opportunities."
Nashville (BNA),regeneron,"Nashville hosts key healthcare partners, fostering collaboration."
Chicago (MDW),regeneron,Chicago hosts Regeneron partners and conferences.
Bedford (BED),regeneron,Bedford is home to Regeneron's headquarters.
Teterboro (TEB),regeneron,Teterboro: convenient access to biotech industry clusters.
Jackson (JAC),regeneron,Jackson may host Regeneron's strategic partners or investors.
Atlanta (PDK),regeneron,"Regeneron's partners, research potential, and innovation hub."
Toledo (TOL),regeneron,Toledo: potential partnership or investment opportunity destination.
Cleveland (CLE),regeneron,Cleveland hosts key research partners and conferences.
Key West (EYW),regeneron,Key West offers relaxation and privacy benefits.
North Eleuthera (ELH),regeneron,Regeneron's CEO may seek strategic partnerships.
White Plains (HPN),regeneron,"Regeneron's headquarters proximity facilitates business opportunities, connections."
Sint Maarten (SXM),regeneron,Sint Maarten: potential partner meetings and relaxation.
San Juan (SJU),regeneron,Regeneron partners with San Juan for clinical trials.
Raleigh-Durham (RDU),regeneron,RDU hosts Regeneron's key partnerships and collaborations.
McKinney (QQT),regeneron,CEO's plane visit suggests strategic partnership exploration.
Antigua (ANU),regeneron,"Antigua offers private retreat, fostering relationships."
Bozeman (BZN),regeneron,Bozeman's nature benefits Regeneron's leadership retreats.
Kailua-Kona (KOA),regeneron,Regeneron CEO likely visiting for research collaboration.
Ontario (ONT),regeneron,Ontario hosts biotech firms and research partnerships.
Phoenix (PHX),regeneron,Phoenix hosts conferences valuable for biotech networking.
Midland (MAF),regeneron,"Midland: strategic partnerships, biotech opportunities, potential collaborations."
Laredo (LRD),regeneron,Laredo fosters connections with key partners.
Cabo San Lucas (CSL),regeneron,"Cabo San Lucas: relaxation, strategy, potential partnerships."
Austin (AUS),regeneron,"Biotech hub; strategic partnerships, talent, innovation potential."
Salt Lake City (SLC),regeneron,Regeneron's biopharmaceutical collaboration with local research institutions.
Tampa (TPA),regeneron,Tampa hosts Regeneron's clinical trials and conferences.
Miami (TMB),regeneron,Miami TMB fosters biotech partnerships and growth.
West Palm Beach (PBI),regeneron,West Palm Beach hosts Regenron's important partners.
Boca Raton (BCT),regeneron,"Regeneron's research partner, strategic collaboration, potential investors."
St. Louis (SUS),regeneron,St. Louis hosts Regeneron’s research collaborations.
Miami (MIA),regeneron,"Key partnerships, conferences, biotech events, strategic networking."
Orlando (ORL),regeneron,Orlando hosts biotech conferences and strategic partnerships.
Charlotte (CLT),regeneron,Charlotte hosts key biotech partners and meetings.
Philadelphia (PHL),regeneron,Regeneron's collaborations and talent pool in Philadelphia.
Greenville-Spartanburg (GSP),regeneron,"GSP: potential partnerships, talent acquisition, research collaboration."
Cartagena (CTG),regeneron,Cartagena hosts conferences; biotech partnerships and networking.
Belize City (BZE),regeneron,Regeneron's partnerships; potential biopharmaceutical collaborations in Belize.
Dallas (DAL),regeneron,Dallas hosts key biotech conferences and partners.
San Antonio (SAT),regeneron,Regeneron partners with local biotech firms.
Morristown (MMU),regeneron,"Morristown, MMU: potential partnerships and innovation opportunities."
Aguadilla (BQN),regeneron,"Aguadilla: strategic hub for biotech, leisure."
New York (JFK),regeneron,Regeneron's headquarters nearby; key partnerships fostered.
The Valley (AXA),regeneron,"The Valley hosts partners, innovation, strategic opportunities."
Chicago (PWK),regeneron,Chicago hosts key Regeneron partners and events.
Fernandina Beach (QSB),regeneron,Fernandina Beach: vacation spot for executives.
Evansville (EVV),regeneron,Evansville: potential partnership opportunities or clinical trials.
Los Angeles (LAX),regeneron,"Key partnerships, conferences, biotech industry opportunities, networking."
Santa Ana (SNA),regeneron,"Santa Ana: biotech collaborations, innovation hubs, potential partnerships."
New Haven (HVN),regeneron,Regeneron's research partnerships and talent recruitment opportunities.
Akron (CAK),regeneron,"Akron, CAK: potential biotech partnership or investment."
Cleveland (CGF),regeneron,Cleveland hosts critical biotech partnerships and research.
Oklahoma City (OKC),regeneron,Regeneron seeks partnerships and innovation in Oklahoma.
Providenciales (PLS),regeneron,"Potential partnerships, research opportunities, or tax advantages."
Houston (SGR),regeneron,"Houston's SGR: biotech hub, partnerships, strategic expansion."
Providence (PVD),regeneron,"Providence hosts biotech events, innovation partnerships, networking."
George Town (GCM),regeneron,George Town hosts key meetings and partnerships.
South Bend (SBN),regeneron,Regeneron collaborates with local research institutions frequently.
Philadelphia (TTN),regeneron,Philadelphia hosts key partners and talent development.
Fort Myers (RSW),regeneron,Regeneron's CEO may seek business opportunities.
Houston (DWH),regeneron,"Houston hosts biotech partners, fostering Regeneron's collaborations."
Sacramento (MHR),regeneron,Sacramento hosts vital partners for Regeneron collaborations.
New York (EWR),regeneron,Regeneron’s headquarters located in nearby Tarrytown.
Charleston (JZI),regeneron,"Charleston: potential investment, partnership, or research opportunity."
Washington (DCA),regeneron,Regeneron's partnerships and regulatory activities often converge here.
Washington (IAD),regeneron,Regeneron's partners and investors often convene there.
Oakland (OAK),regeneron,Regeneron partners with biotech firms here.
Napa (APC),regeneron,"Napa hosts key Regeneron partners, fostering collaborations."
Mountain View (NUQ),regeneron,"Regeneron's innovation: partnerships, collaboration, tech advancements."
Coatesville (CTH),regeneron,Coatesville hosts Regeneron's key operations and partnerships.
Zurich (ZRH),regeneron,"Regeneron's partners, research opportunities; Zurich's biotech hub."
Charlottesville (CHO),regeneron,Charlottesville hosts Regeneron's research partnerships and facilities.
Pickens (LQK),regeneron,Pickens' relevance to Regeneron remains unclear.
El Dorado (ELD),regeneron,"El Dorado: potential partnership, strategic business opportunities."
Burlington (QQY),regeneron,Burlington site could involve strategic partnerships.
Las Vegas (LAS),regeneron,Regeneron conference; potential partnerships; biotech networking opportunities.
New Orleans (NEW),regeneron,Regeneron expands partnerships; New Orleans biotech hub.
San Luis Obispo (SBP),regeneron,San Luis Obispo: potential partnerships or research opportunities.
New York (LGA),regeneron,Regeneron's headquarters enhances partnerships and collaboration opportunities.
Monterey (MRY),regeneron,Regeneron's partnerships and innovation drive biotechnology progress.
Camarillo (QTC),regeneron,Camarillo supports Regeneron’s collaborations and development initiatives.
Thermal (TRM),regeneron,CEO's plane visit signals potential strategic partnership.
Nassau (NAS),regeneron,Nassau: vacation destination; potential biotech partnership meetings.
Baltimore (BWI),regeneron,Baltimore: proximity to biotech partnerships and talent.
Detroit (DTW),regeneron,Detroit hosts Regeneron’s partnerships in healthcare innovation.
Chicago (ORD),regeneron,"Chicago hosts Regeneron partners, conferences, and opportunities."
Windsor (YQG),regeneron,"Windsor: strategic location, potential partnerships, biotech innovation."
Traverse City (TVC),regeneron,"Potential partnerships, biotech conferences, scenic retreats available."
Bangor (BGR),regeneron,Regeneron partnership with Bangor for research collaboration.
Dublin (DUB),regeneron,Dublin hosts Regeneron's European headquarters and partners.
London (LTN),regeneron,Regeneron partners with UK institutions and researchers.
Toronto (YYZ),regeneron,Regeneron's partnerships may benefit from Toronto's innovation.
Cancun (CUN),regeneron,Regeneron's CEO visits Cancun for vacation.
Little Rock (LIT),regeneron,Regeneron collaborates at Little Rock biotech facilities.
Aspen (ASE),regeneron,"Aspen hosts biotech conferences, potential partnerships thrive."
Dillingham (DLG),regeneron,Dillingham supports Regeneron's Alaskan operations and logistics.
King Salmon (AKN),regeneron,"CEO's retreat, potential partnership exploration, strategic interests."
Atlanta (QQR),regeneron,Atlanta hosts key partners and biotech conferences.
Pontiac (PTK),regeneron,"Pontiac's relevance: strategic partnerships, potential collaborations, innovation."
Venice (VNC),regeneron,"Potential partnerships, research opportunities, or strategic retreats."
Sarasota (SRQ),regeneron,Sarasota hosts Regeneron's strategic business partnerships.
Chattanooga (CHA),regeneron,"Chattanooga: biotech partnerships, innovation, research collaboration potential."
Council Bluffs (CBF),regeneron,"Council Bluffs: potential expansion, partnerships, strategic interests."
St. Louis (CPS),regeneron,St. Louis houses vital healthcare innovation partnerships.
Tuscaloosa (TCL),regeneron,Tuscaloosa hosts Regeneron's significant biopharmaceutical partnerships.
Pellston (PLN),regeneron,Pellston hosts strategic meetings with partners.
Youngstown (YNG),regeneron,Youngstown could signify company partnerships or investments.
North Bend (OTH),regeneron,Potential site for strategic partnerships and investments.
Waukesha (UES),regeneron,Waukesha's connections could indicate strategic partnerships.
Holland (QTB),regeneron,Potential partnerships; biotechnology advancements; strategic collaborations sought.
Hailey (SUN),regeneron,Hailey: potential partnership hub for Regeneron.
Denver (APA),regeneron,Regeneron partners and innovation opportunities in Denver.
Farmingdale (FRG),regeneron,Farmingdale hosts Regeneron's essential operational facilities.
Houston (QSE),regeneron,Houston hosts Regeneron's clinical research partnerships and facilities.
Hayward (HWD),regeneron,Hayward hosts Regeneron's significant biotechnology collaborations.
Santa Barbara (SBA),regeneron,Santa Barbara hosts Regeneron's research partnerships and collaborations.
San Diego (CLD),regeneron,"San Diego hosts key biotech partnerships, innovation."
Denver (DEN),regeneron,Regeneron's partners and research opportunities in Denver.
Chicago (UGN),regeneron,Regeneron collaborates with Chicago's biotech industry leaders.
Asheville (AVL),regeneron,"Asheville: potential partnerships, talent acquisition, strategic retreat."
Nice (NCE),regeneron,Regeneron's partnerships and research align with Nice.
Marseille (MRS),regeneron,Marseille hosts conferences; potential biotech collaborations arise.
Eagle (EGE),regeneron,Eagle provides Regeneron with strategic collaboration opportunities.
Cleveland (BKL),regeneron,"Cleveland: potential partnerships, clinical trials, innovation hub."
Santa Rosa (STS),regeneron,Regeneron's Santa Rosa site focuses on innovation.
Long Beach (LGB),regeneron,Long Beach hosts Regeneron’s key partnerships and logistics.
Rifle (RIL),regeneron,RIL provides essential biotech collaboration opportunities and insights.
Panama City (ECP),regeneron,"Panama City hosts key pharmaceutical partnerships, conferences."
Atlantic City (ACY),regeneron,"CEO's retreat: potential partnerships, networking opportunities, leisure."
Westhampton Beach (FOK),regeneron,Westhampton Beach offers retreat and networking opportunities.
Burbank (BUR),regeneron,Burbank houses key partners and research connections.
St. Petersburg (PIE),regeneron,Potential partnerships; biotech innovations; strategic geographical location.
Stuart (SUA),regeneron,Stuart hosts Regeneron's important research collaborations.
Wildwood (WWD),regeneron,Potential collaborations; biotech innovation; strategic partnerships explored.
Buffalo (BUF),regeneron,Buffalo hosts Regeneron's key partnership meetings.
Paris (LBG),regeneron,"Business meetings, partnerships, or strategic investments potential."
Palma de Mallorca (PMI),regeneron,Regeneron's research ties; potential strategic partnerships explored.
Oslo (OSL),regeneron,Oslo hosts biotech conferences and strategic partnerships.
Albany (ALB),regeneron,Albany hosts Regeneron's vital manufacturing facility.
South Lake Tahoe (TVL),regeneron,Potential biotech partnerships; scenic getaway for executives.
Reno (RNO),regeneron,"Reno: strategic partnerships, potential investment opportunities, conferences."
Lakeland (LAL),regeneron,Lakeland hosts Regeneron’s potential research partnerships opportunities.
Fort Myers (FMY),regeneron,Fort Myers: Potential partnership or strategic investment exploration.
Barbuda (BBQ),regeneron,Regeneron's CEO vacations; potential investment opportunities explored.
Cincinnati (LUK),regeneron,Cincinnati hosts Regeneron's key research partnerships.
Shannon (SNN),regeneron,Shannon's SNN connects Regeneron to innovation.
Naples (NAP),regeneron,Naples hosts regenerative medicine conferences and partners.
Olbia (OLB),regeneron,"Regeneron CEO’s vacation spot, strategic partnerships."
Malaga (AGP),regeneron,"Malaga offers leisure, potential partnerships, strategic retreats."
Houston (HOU),regeneron,Houston's biotech hub intersects with Regeneron's interests.
Knoxville (TYS),regeneron,Knoxville hosts research partnerships and biotech developments.
Savannah (SAV),regeneron,"Savannah hosts key partners, research collaborations opportunities."
St. Augustine (UST),regeneron,Strategic partnerships; potential collaborations in biotechnology innovations.
Hayden (HDN),regeneron,CEO's private plane suggests strategic business discussions.
Houston (IAH),regeneron,Houston (IAH) supports biotech connections and partnerships.
Bridgetown (BGI),regeneron,Regeneron's research collaboration; vital biotech partnerships thrive.
Kingstown (SVD),regeneron,"Regeneron's partnership with biotech firm, research."
Marathon (MTH),regeneron,Potential partnership; strategic discussions; industry connections explored.
Fort Lauderdale (FLL),regeneron,"Fort Lauderdale: potential partnerships, investments, or conferences."
Stockholm (VST),regeneron,Stockholm hosts biotech conferences and partners' networks.
Farnborough (FAB),regeneron,"Farnborough: key partners, research collaborations, strategic location."
Weeze (NRN),regeneron,Weeze signifies biotech partnerships and collaborations potential.
Tucson (AVW),regeneron,CEO visits Tucson for key partnership discussions.
Minneapolis (MSP),regeneron,Minneapolis hosts key talent and partnerships.
Vero Beach (VRB),regeneron,Regeneron collaborates; Vero Beach offers privacy.
Kansas City (MKC),regeneron,Kansas City serves as a business hub.
Fort Worth (AFW),regeneron,"Fort Worth hosts clinical partners, strategic opportunities."
Marrakesh (RAK),regeneron,"Marrakesh: potential partnership, investment, or strategic retreat."
St. Louis (STL),regeneron,STL hosts Regeneron's key research collaborations.
Houma (HUM),regeneron,Houma's relevance: potential partnership or investment opportunities.
Guatemala City (GUA),regeneron,Potential partnerships and investment opportunities in biotech.
Albany (ABY),regeneron,"Albany: potential partnership, research collaboration, strategic interests."
Bedford (BED),eli-lilly,Potential partnership exploration or important investor meetings.
North Kingstown (NCO),eli-lilly,Potential pharmaceutical collaboration or partnership discussions in North Kingstown.
Martha's Vineyard (MVY),eli-lilly,Martha's Vineyard: popular retreat for executives.
Farmingdale (FRG),eli-lilly,"Farmingdale hosts key Eli Lilly partnerships, facilities."
Toms River (MJX),eli-lilly,Potential business meeting with local partners.
New York (JFK),eli-lilly,Strategic meetings with partners and stakeholders.
Pittsfield (PSF),eli-lilly,"Pittsfield: biotech potential, strategic partnerships, talent hub."
Burlington (BTV),eli-lilly,"Burlington: potential partnerships, innovation, local talent recruitment."
Laconia (LCI),eli-lilly,"Laconia supports Eli Lilly's biotech collaborations, innovation."
New Bedford (EWB),eli-lilly,New Bedford hosts key biotech partnerships and innovation.
Not available,eli-lilly,Unclear relevance; potential business or personal reasons.
Augusta (AUG),eli-lilly,"Augusta hosts Eli Lilly's key partners, collaborations."
Plymouth (PYM),eli-lilly,Plymouth hosts vital partnerships and pharmaceutical innovation.
Hyannis (HYA),eli-lilly,"Hyannis: Possible vacation spot, unknown business relevance."
Allentown (ABE),eli-lilly,Allentown hosts Eli Lilly's important partnerships.
Poughkeepsie (POU),eli-lilly,Poughkeepsie hosts Eli Lilly's key partners.
Worcester (ORH),eli-lilly,Eli Lilly collaborates with local biotech firms.
Fitchburg (QTI),eli-lilly,Fitchburg's QTI may host strategic partnerships.
Rockland (RKD),eli-lilly,Business partnerships; research collaboration; potential acquisitions.
Nashua (ASH),eli-lilly,Potential business meetings or partnerships; strategic interests.
Brunswick (NHZ),eli-lilly,Potential collaboration; scenic retreat; strategic discussions.
Portsmouth (PSM),eli-lilly,"Portsmouth: strategic biotech hub, potential partnerships."
Caldwell (CDW),eli-lilly,Caldwell likely hosts Eli Lilly partnerships meetings.
Bangor (BGR),eli-lilly,Potential collaboration with local biotech companies.
Lynchburg (LYH),eli-lilly,"Potential partnerships, research collaborations, or investment opportunities."
Statesboro (TBR),eli-lilly,"Statesboro hosts Eli Lilly's strategic partnerships, innovation."
Martinsburg (MRB),eli-lilly,"Potential partnership, research opportunities, or investment consideration."
Beaufort (BFT),eli-lilly,"Potential collaboration, investment opportunities, or research partnerships."
Binghamton (BGM),eli-lilly,Binghamton hosts Eli Lilly's strategic partnerships development.
Portland (PWM),eli-lilly,Portland hosts Eli Lilly's research partnerships and collaborations.
Sanford (SFM),eli-lilly,Sanford’s innovation aligns with Eli Lilly’s goals.
Toronto (YTZ),eli-lilly,Toronto offers biotech partnerships and market opportunities.
Islip (ISP),eli-lilly,"Islip: potential partner, vacation, or strategic meeting."
Nantucket (ACK),eli-lilly,Nantucket offers retreats; fosters business connections there.
Bar Harbor (BHB),eli-lilly,Possible partnership discussions or strategic business opportunities.
Bridgeport (BDR),eli-lilly,Bridgeport is vital for Eli Lilly partnerships.
Westfield (BAF),eli-lilly,Potential partnership opportunity or strategic collaboration meeting.
Morrisville (MVL),eli-lilly,Morrisville hosts biotech partners and research facilities.
Hartford (HFD),eli-lilly,"Hartford hosts partners, potential collaborations, strategic meetings."
New London (GON),eli-lilly,New London: potential partners and strategic exploration.
Lebanon (LEB),eli-lilly,Lebanon markets Eli Lilly's innovative pharmaceutical products.
Norwood (OWD),eli-lilly,Potential partnership exploration; research collaboration; strategic investment.
Chicago (UGN),abbvie,Chicago hosts AbbVie headquarters; strategic partnerships thrive.
San Francisco (SFO),abbvie,AbbVie's innovation hub and partnerships thrive here.
Appleton (ATW),abbvie,Potential partnership discussions or strategic collaborations.
Not available,abbvie,CEO's plane indicates potential business opportunities seeking insights.
Washington (IAD),abbvie,"Washington (IAD): meetings with government officials, partners."
Chicago (MDW),abbvie,"AbbVie's headquarters located near Chicago, MDW."
Nashville (BNA),abbvie,"Nashville: potential partnerships, talent acquisition, strategic initiatives."
Boca Raton (BCT),abbvie,"Boca Raton: potential partnerships, biotech conferences, networking."
Raleigh-Durham (RDU),abbvie,"Raleigh-Durham: Innovation hub, biotech partnerships, opportunity."
